name,text,publish_date,url,privacy,user_id
Result practice talk prac,Challenge reveal yet production night. Home pattern feel season along work may box.,2023-12-22 15:41:15.416089,https://www.cook.com/,private,4
Court company personal th,Green box dark exist along. Later our pressure. Any else save today suggest care call. Population foreign baby rest according today else.,2023-12-22 15:41:15.416490,https://www.edwards.com/,private,1
Remain their huge power w,Light interview born sort economic.,2023-12-22 15:41:15.416739,https://www.martinez.com/,private,4
Financial fight effort. E,Development catch off soon reach live door. Understand heart raise amount.,2023-12-22 15:41:15.416961,https://www.davis.biz/,private,4
Minute care win yeah offi,While tax bring candidate son. Will hear by.,2023-12-22 15:41:15.417220,https://lambert.info/,private,1
Opportunity fire gun proc,College particularly third human close your short. Gun kid any response well car.,2023-12-22 15:41:15.417355,https://www.duncan-ellis.com/,private,3
Exactly short investment ,Success write rock left bad while eat. Enjoy sign low land off ahead. Five wear religious unit summer.,2023-12-22 15:41:15.417551,https://lamb.biz/,private,5
Management everybody here,Simply another medical chance. On staff per recognize.,2023-12-22 15:41:15.417921,https://mendoza-deleon.net/,private,5
Recognize also tough who.,Cell yes war company result close four. Offer few plan wide up which. Thing ever sea happy road.,2023-12-22 15:41:15.418127,http://mcdonald.com/,private,4
People pass decade voice ,Everything off grow debate light laugh adult guy. Film himself father season direction.,2023-12-22 15:41:15.418257,https://www.house.com/,private,1
