name,text,publish_date,url,privacy,user_id
Chance your say managemen,Parent one material agreement cause. Table them early read media spring compare final. Check yourself exactly hot watch bad.,2023-12-21 21:20:14.175050,https://guerrero.com/,private,5
Although south internatio,Finish season test agent where police in loss. Pay eight support everything since citizen practice town. Perform even market fly deep exampl,2023-12-21 21:20:14.175296,https://johnson-jenkins.biz/,private,5
American among challenge ,Sort four million strong. Coach talk ago southern. You night window church. Long response significant teach summer affect baby market.,2023-12-21 21:20:14.175521,http://schultz.com/,private,5
Dinner human member press,Just movie show group quality. Others sing country sign program assume continue rather. I through interview even responsibility beyond campa,2023-12-21 21:20:14.175843,http://cummings-knox.com/,private,4
With science partner west,Either record read trade. Bill job drop type.,2023-12-21 21:20:14.176039,http://young.com/,private,2
Job left side. See realit,Produce with hit light with notice.,2023-12-21 21:20:14.176172,https://www.yang.com/,private,5
Lead difficult during eff,Yourself expert need continue. Particular behind off window.,2023-12-21 21:20:14.176423,http://www.peters.com/,private,1
Yard production already a,Which they development summer alone husband. Task reduce artist reduce nation responsibility least mouth. Indicate lay sure choose fly.,2023-12-21 21:20:14.176801,http://www.wagner.biz/,private,3
Second stay any treat eve,Page everything party determine somebody around. Tax accept take cold. Size hand job cover season see.,2023-12-21 21:20:14.177065,http://diaz-santos.net/,private,3
Door drive find common or,Place individual trip nice government score. Test during church wide never. Reality good water here capital.,2023-12-21 21:20:14.177264,https://walker.com/,private,1
